{"token_id":"00000000-0000-7000-8000-000000000007","intent_id":"00000000-0000-7000-8000-000000000001","confirmed_revision_id":"00000000-0000-7000-8000-000000000002","confirmed_revision_hash":"0000000000000000000000000000000000000000000000000000000000000000","approved_content_hash":"1111111111111111111111111111111111111111111111111111111111111111","actor_id":"alice","issued_at":"2026-09-11T00:00:00Z","expires_at":"2026-09-11T00:05:00Z","challenge":"APPROVE-123456","interactive_tty":true,"consumed":false}
